{
  "$schema": "https://json-schema.org/draft/2020-12/schema",
  "$id": "contracts/rescue-ai/v1/rescue-evidence.schema.json",
  "title": "rescue-ai-evidence",
  "description": "Bounded metadata contract for an optional external Ventoy/Linux rescue companion. This contract is validation/provenance only: it MUST NOT carry prompts, model responses, credentials, private keys, raw logs, arbitrary commands, or unrestricted paths. Cloud AI egress fails closed (docs/ai-data-privacy-and-model-security.md section 4, ADR-0029): `ai_analysis_status: completed` is accepted only with `ai_provider.destination_class: cloud`, a `classification` of public, internal, or confidential, and an `egress_decision_ref` pointing at the recorded allow/approval outcome of the ai-egress policy decision. RESTRICTED data can never be recorded as completed cloud analysis, whatever the reference says; unknown/missing destinations are denied. This validator has no if/then keyword, so the rule is expressed as a oneOf over mutually exclusive branches.",
  "type": "object",
  "required": [
    "schema_version",
    "run_id",
    "source_platform",
    "boot_mode",
    "collected_at",
    "target_device_opaque_id",
    "checks",
    "evidence_manifest",
    "ai_provider",
    "ai_analysis_status",
    "mutation_status",
    "verification",
    "classification"
  ],
  "additionalProperties": false,
  "properties": {
    "schema_version": {
      "type": "string",
      "const": "1.0"
    },
    "run_id": {
      "type": "string",
      "pattern": "^[A-Za-z0-9][A-Za-z0-9._-]{7,63}$"
    },
    "source_platform": {
      "type": "string",
      "enum": [
        "linux-mint-xfce-live",
        "systemrescue-live",
        "other-live-linux"
      ]
    },
    "boot_mode": {
      "type": "string",
      "enum": [
        "uefi",
        "legacy-bios",
        "unknown"
      ]
    },
    "collected_at": {
      "type": "string",
      "pattern": "^\\d{4}-\\d{2}-\\d{2}T\\d{2}:\\d{2}:\\d{2}Z$"
    },
    "target_device_opaque_id": {
      "type": "string",
      "description": "Operator-generated opaque identifier; not a serial number or raw device path.",
      "pattern": "^target-[A-Za-z0-9][A-Za-z0-9._-]{3,47}$"
    },
    "ventoy_version": {
      "type": [
        "string",
        "null"
      ],
      "pattern": "^[0-9]+\\.[0-9]+\\.[0-9]+$"
    },
    "linux_release": {
      "type": [
        "string",
        "null"
      ],
      "pattern": "^[A-Za-z0-9][A-Za-z0-9 ._+()/-]{0,63}$"
    },
    "checks": {
      "type": "array",
      "minItems": 1,
      "maxItems": 32,
      "items": {
        "type": "object",
        "required": [
          "check_id",
          "status",
          "source",
          "observed_at"
        ],
        "additionalProperties": false,
        "properties": {
          "check_id": {
            "type": "string",
            "enum": [
              "block-device-discovery",
              "filesystem-discovery",
              "firmware-boot-entry",
              "kernel-log",
              "system-journal",
              "smart-health",
              "nvme-health",
              "lvm-or-raid-discovery",
              "filesystem-read-only",
              "network-connectivity",
              "iso-integrity"
            ]
          },
          "status": {
            "type": "string",
            "enum": [
              "pass",
              "fail",
              "warn",
              "not_applicable",
              "unknown"
            ]
          },
          "source": {
            "type": "string",
            "enum": [
              "collector-allowlist",
              "linux-mint-documentation",
              "ventoy-documentation",
              "operator-observation"
            ]
          },
          "observed_at": {
            "type": "string",
            "pattern": "^\\d{4}-\\d{2}-\\d{2}T\\d{2}:\\d{2}:\\d{2}Z$"
          }
        }
      }
    },
    "evidence_manifest": {
      "type": "object",
      "required": [
        "entry_count",
        "manifest_sha256",
        "storage_class"
      ],
      "additionalProperties": false,
      "properties": {
        "entry_count": {
          "type": "integer",
          "minimum": 0,
          "maximum": 10000
        },
        "manifest_sha256": {
          "type": "string",
          "pattern": "^[a-f0-9]{64}$"
        },
        "storage_class": {
          "type": "string",
          "enum": [
            "volatile-live-session",
            "encrypted-external",
            "operator-controlled-local"
          ]
        }
      }
    },
    "ai_provider": {
      "type": "object",
      "required": [
        "provider_id",
        "model_id",
        "authenticated",
        "destination_class"
      ],
      "additionalProperties": false,
      "properties": {
        "provider_id": {
          "type": "string",
          "const": "opencode-go"
        },
        "model_id": {
          "type": "string",
          "pattern": "^[A-Za-z0-9][A-Za-z0-9._:/-]{1,127}$"
        },
        "authenticated": {
          "type": "boolean"
        },
        "destination_class": {
          "type": "string",
          "enum": [
            "cloud",
            "unknown"
          ]
        }
      }
    },
    "ai_analysis_status": {
      "type": "string",
      "enum": [
        "not_run",
        "completed",
        "manual_intervention",
        "blocked"
      ]
    },
    "mutation_status": {
      "type": "string",
      "enum": [
        "none",
        "approval_required",
        "completed_verified"
      ]
    },
    "verification": {
      "type": "object",
      "required": [
        "hashes_verified",
        "read_back_verified",
        "status"
      ],
      "additionalProperties": false,
      "properties": {
        "hashes_verified": {
          "type": "boolean"
        },
        "read_back_verified": {
          "type": "boolean"
        },
        "status": {
          "type": "string",
          "enum": [
            "pass",
            "fail",
            "partial",
            "not_applicable"
          ]
        }
      }
    },
    "classification": {
      "type": "string",
      "enum": [
        "public",
        "internal",
        "confidential",
        "restricted"
      ],
      "description": "Lowercase form of the ai-egress data classes (PUBLIC, INTERNAL, CONFIDENTIAL, RESTRICTED)."
    },
    "source_references": {
      "type": "array",
      "maxItems": 16,
      "items": {
        "type": "string",
        "enum": [
          "linuxmint:iso-verification",
          "ventoy:install-update",
          "ventoy:secure-boot",
          "opencode-go:provider",
          "opencode:cli",
          "nist:sp-800-86",
          "gnu:ddrescue"
        ]
      }
    },
    "egress_decision_ref": {
      "type": "object",
      "description": "Opaque reference to the recorded ai-egress policy outcome (contracts/ai-egress/v1/egress-decision-response.schema.json) that authorized sending sanitized content to the cloud destination. Metadata only: it never echoes prompt/response content. For confidential data `approval_id` must also reference the owner approval (contracts/control-center/v1/ai-egress-approval.response.schema.json). A restricted classification is never accepted with a completed cloud analysis, with or without this reference.",
      "required": [
        "policy_version",
        "classification",
        "destination",
        "decision",
        "reason_code"
      ],
      "additionalProperties": false,
      "properties": {
        "policy_version": {
          "type": "string",
          "pattern": "^[A-Za-z0-9_.-]{1,32}$"
        },
        "classification": {
          "type": "string",
          "enum": [
            "PUBLIC",
            "INTERNAL",
            "CONFIDENTIAL"
          ]
        },
        "destination": {
          "type": "string",
          "const": "cloud_sanitized"
        },
        "decision": {
          "type": "string",
          "const": "allow"
        },
        "reason_code": {
          "type": "string",
          "enum": [
            "AI_EGRESS_ALLOW_PUBLIC_CLOUD_POLICY",
            "AI_EGRESS_ALLOW_CLOUD_SANITIZED_APPROVED"
          ]
        },
        "approval_id": {
          "type": "string",
          "pattern": "^[A-Za-z0-9_.:-]{1,128}$"
        }
      }
    }
  },
  "oneOf": [
    {
      "description": "No analysis was sent to a model (not_run, manual_intervention, blocked): any classification and destination is recordable.",
      "properties": {
        "ai_analysis_status": {
          "enum": [
            "not_run",
            "manual_intervention",
            "blocked"
          ]
        }
      }
    },
    {
      "description": "completed cloud analysis of public data requires a matching egress_decision_ref",
      "required": [
        "egress_decision_ref"
      ],
      "properties": {
        "ai_analysis_status": {
          "const": "completed"
        },
        "classification": {
          "const": "public"
        },
        "ai_provider": {
          "type": "object",
          "properties": {
            "destination_class": {
              "const": "cloud"
            }
          }
        },
        "egress_decision_ref": {
          "type": "object",
          "properties": {
            "classification": {
              "const": "PUBLIC"
            },
            "reason_code": {
              "const": "AI_EGRESS_ALLOW_PUBLIC_CLOUD_POLICY"
            }
          }
        }
      }
    },
    {
      "description": "completed cloud analysis of internal data requires a matching egress_decision_ref",
      "required": [
        "egress_decision_ref"
      ],
      "properties": {
        "ai_analysis_status": {
          "const": "completed"
        },
        "classification": {
          "const": "internal"
        },
        "ai_provider": {
          "type": "object",
          "properties": {
            "destination_class": {
              "const": "cloud"
            }
          }
        },
        "egress_decision_ref": {
          "type": "object",
          "properties": {
            "classification": {
              "const": "INTERNAL"
            },
            "reason_code": {
              "const": "AI_EGRESS_ALLOW_CLOUD_SANITIZED_APPROVED"
            }
          }
        }
      }
    },
    {
      "description": "completed cloud analysis of confidential data requires a matching egress_decision_ref",
      "required": [
        "egress_decision_ref"
      ],
      "properties": {
        "ai_analysis_status": {
          "const": "completed"
        },
        "classification": {
          "const": "confidential"
        },
        "ai_provider": {
          "type": "object",
          "properties": {
            "destination_class": {
              "const": "cloud"
            }
          }
        },
        "egress_decision_ref": {
          "type": "object",
          "properties": {
            "classification": {
              "const": "CONFIDENTIAL"
            },
            "reason_code": {
              "const": "AI_EGRESS_ALLOW_CLOUD_SANITIZED_APPROVED"
            }
          },
          "required": [
            "approval_id"
          ]
        }
      }
    }
  ]
}
