{
  "schema_version": "1.0",
  "run_id": "rescue-20260929-0004",
  "source_platform": "linux-mint-xfce-live",
  "boot_mode": "uefi",
  "collected_at": "2026-09-29T10:30:00Z",
  "target_device_opaque_id": "target-laptop-a1b2",
  "checks": [
    {
      "check_id": "block-device-discovery",
      "status": "pass",
      "source": "collector-allowlist",
      "observed_at": "2026-09-29T10:31:00Z"
    }
  ],
  "evidence_manifest": {
    "entry_count": 0,
    "manifest_sha256": "aaaaaaaaaaaaaaaaaaaaaaaaaaaaaaaaaaaaaaaaaaaaaaaaaaaaaaaaaaaaaaaa",
    "storage_class": "volatile-live-session"
  },
  "ai_provider": {
    "provider_id": "opencode-go",
    "model_id": "opencode/gpt-5.6-luna",
    "authenticated": false,
    "destination_class": "unknown"
  },
  "ai_analysis_status": "blocked",
  "mutation_status": "none",
  "verification": {
    "hashes_verified": false,
    "read_back_verified": false,
    "status": "not_applicable"
  },
  "classification": "restricted"
}
